[93m[WARNING] Model folder already exists...[0m
[92m[INFO] Best epoch number: 78[0m
[93m[WARNING] Model folder already exists...[0m
[92m[INFO] Best epoch number: 78[0m
Epoch 1/78
5177/5177 - 353s - loss: 7.7553 - accuracy: 0.0408 - top_5: 0.0817 - top_10: 0.1072
Epoch 2/78
5177/5177 - 247s - loss: 7.5978 - accuracy: 0.0811 - top_5: 0.1666 - top_10: 0.2135
Epoch 3/78
5177/5177 - 227s - loss: 7.3816 - accuracy: 0.0841 - top_5: 0.1787 - top_10: 0.2327
Epoch 4/78
5177/5177 - 230s - loss: 7.0997 - accuracy: 0.0973 - top_5: 0.1877 - top_10: 0.2452
Epoch 5/78
5177/5177 - 225s - loss: 6.7933 - accuracy: 0.1166 - top_5: 0.2050 - top_10: 0.2620
Epoch 6/78
5177/5177 - 216s - loss: 6.5054 - accuracy: 0.1399 - top_5: 0.2329 - top_10: 0.2862
Epoch 7/78
5177/5177 - 215s - loss: 6.2343 - accuracy: 0.1631 - top_5: 0.2639 - top_10: 0.3141
Epoch 8/78
5177/5177 - 215s - loss: 5.9856 - accuracy: 0.1848 - top_5: 0.2931 - top_10: 0.3454
Epoch 9/78
5177/5177 - 217s - loss: 5.7505 - accuracy: 0.2032 - top_5: 0.3234 - top_10: 0.3810
Epoch 10/78
5177/5177 - 221s - loss: 5.5280 - accuracy: 0.2203 - top_5: 0.3536 - top_10: 0.4155
Epoch 11/78
5177/5177 - 228s - loss: 5.3209 - accuracy: 0.2366 - top_5: 0.3812 - top_10: 0.4458
Epoch 12/78
5177/5177 - 231s - loss: 5.1304 - accuracy: 0.2517 - top_5: 0.4052 - top_10: 0.4729
Epoch 13/78
5177/5177 - 232s - loss: 4.9493 - accuracy: 0.2658 - top_5: 0.4276 - top_10: 0.4995
Epoch 14/78
5177/5177 - 232s - loss: 4.7887 - accuracy: 0.2782 - top_5: 0.4469 - top_10: 0.5217
Epoch 15/78
5177/5177 - 231s - loss: 4.6367 - accuracy: 0.2907 - top_5: 0.4663 - top_10: 0.5419
Epoch 16/78
5177/5177 - 233s - loss: 4.4983 - accuracy: 0.3026 - top_5: 0.4827 - top_10: 0.5605
Epoch 17/78
[93m[WARNING] Model folder already exists...[0m
[92m[INFO] Best epoch number: 78[0m
Epoch 1/78
5177/5177 - 192s - loss: 7.7553 - accuracy: 0.0408 - top_5: 0.0817 - top_10: 0.1072
Epoch 2/78
5177/5177 - 206s - loss: 7.5978 - accuracy: 0.0811 - top_5: 0.1666 - top_10: 0.2135
Epoch 3/78
5177/5177 - 192s - loss: 7.3816 - accuracy: 0.0841 - top_5: 0.1787 - top_10: 0.2327
Epoch 4/78
5177/5177 - 200s - loss: 7.0997 - accuracy: 0.0973 - top_5: 0.1877 - top_10: 0.2452
Epoch 5/78
5177/5177 - 204s - loss: 6.7933 - accuracy: 0.1166 - top_5: 0.2050 - top_10: 0.2620
Epoch 6/78
5177/5177 - 207s - loss: 6.5054 - accuracy: 0.1399 - top_5: 0.2329 - top_10: 0.2862
Epoch 7/78
5177/5177 - 209s - loss: 6.2343 - accuracy: 0.1631 - top_5: 0.2639 - top_10: 0.3141
Epoch 8/78
5177/5177 - 217s - loss: 5.9856 - accuracy: 0.1848 - top_5: 0.2931 - top_10: 0.3454
Epoch 9/78
5177/5177 - 220s - loss: 5.7505 - accuracy: 0.2032 - top_5: 0.3234 - top_10: 0.3810
Epoch 10/78
5177/5177 - 228s - loss: 5.5280 - accuracy: 0.2203 - top_5: 0.3536 - top_10: 0.4155
Epoch 11/78
5177/5177 - 228s - loss: 5.3209 - accuracy: 0.2366 - top_5: 0.3812 - top_10: 0.4458
Epoch 12/78
5177/5177 - 234s - loss: 5.1304 - accuracy: 0.2517 - top_5: 0.4052 - top_10: 0.4729
Epoch 13/78
5177/5177 - 229s - loss: 4.9493 - accuracy: 0.2658 - top_5: 0.4276 - top_10: 0.4995
Epoch 14/78
5177/5177 - 234s - loss: 4.7887 - accuracy: 0.2782 - top_5: 0.4469 - top_10: 0.5217
Epoch 15/78
5177/5177 - 230s - loss: 4.6374 - accuracy: 0.2908 - top_5: 0.4657 - top_10: 0.5419
Epoch 16/78
5177/5177 - 248s - loss: 4.4986 - accuracy: 0.3022 - top_5: 0.4826 - top_10: 0.5605
Epoch 17/78
5177/5177 - 239s - loss: 4.3725 - accuracy: 0.3136 - top_5: 0.4975 - top_10: 0.5779
Epoch 18/78
5177/5177 - 234s - loss: 4.2596 - accuracy: 0.3233 - top_5: 0.5117 - top_10: 0.5932
Epoch 19/78
5177/5177 - 227s - loss: 4.1597 - accuracy: 0.3329 - top_5: 0.5237 - top_10: 0.6061
Epoch 20/78
5177/5177 - 229s - loss: 4.0673 - accuracy: 0.3424 - top_5: 0.5360 - top_10: 0.6195
Epoch 21/78
5177/5177 - 226s - loss: 3.9854 - accuracy: 0.3511 - top_5: 0.5470 - top_10: 0.6303
Epoch 22/78
5177/5177 - 233s - loss: 3.9136 - accuracy: 0.3602 - top_5: 0.5577 - top_10: 0.6409
Epoch 23/78
5177/5177 - 223s - loss: 3.8518 - accuracy: 0.3682 - top_5: 0.5670 - top_10: 0.6498
Epoch 24/78
5177/5177 - 227s - loss: 3.7960 - accuracy: 0.3757 - top_5: 0.5752 - top_10: 0.6575
Epoch 25/78
5177/5177 - 224s - loss: 3.7407 - accuracy: 0.3829 - top_5: 0.5840 - top_10: 0.6656
Epoch 26/78
5177/5177 - 224s - loss: 3.6876 - accuracy: 0.3905 - top_5: 0.5924 - top_10: 0.6738
Epoch 27/78
5177/5177 - 221s - loss: 3.6386 - accuracy: 0.3979 - top_5: 0.6001 - top_10: 0.6803
Epoch 28/78
5177/5177 - 226s - loss: 3.5916 - accuracy: 0.4048 - top_5: 0.6079 - top_10: 0.6871
Epoch 29/78
5177/5177 - 227s - loss: 3.5534 - accuracy: 0.4101 - top_5: 0.6142 - top_10: 0.6928
Epoch 30/78
5177/5177 - 226s - loss: 3.5086 - accuracy: 0.4168 - top_5: 0.6207 - top_10: 0.6985
Epoch 31/78
5177/5177 - 225s - loss: 3.4723 - accuracy: 0.4226 - top_5: 0.6267 - top_10: 0.7036
Epoch 32/78
5177/5177 - 226s - loss: 3.4362 - accuracy: 0.4279 - top_5: 0.6324 - top_10: 0.7086
Epoch 33/78
5177/5177 - 226s - loss: 3.4004 - accuracy: 0.4332 - top_5: 0.6378 - top_10: 0.7129
Epoch 34/78
5177/5177 - 222s - loss: 3.3614 - accuracy: 0.4393 - top_5: 0.6441 - top_10: 0.7182
Epoch 35/78
5177/5177 - 216s - loss: 3.3324 - accuracy: 0.4442 - top_5: 0.6490 - top_10: 0.7220
Epoch 36/78
5177/5177 - 228s - loss: 3.3016 - accuracy: 0.4489 - top_5: 0.6531 - top_10: 0.7254
Epoch 37/78
5177/5177 - 225s - loss: 3.2688 - accuracy: 0.4538 - top_5: 0.6580 - top_10: 0.7296
Epoch 38/78
5177/5177 - 225s - loss: 3.2382 - accuracy: 0.4591 - top_5: 0.6625 - top_10: 0.7329
Epoch 39/78
5177/5177 - 219s - loss: 3.2106 - accuracy: 0.4639 - top_5: 0.6665 - top_10: 0.7357
Epoch 40/78
5177/5177 - 227s - loss: 3.1881 - accuracy: 0.4677 - top_5: 0.6697 - top_10: 0.7388
Epoch 41/78
5177/5177 - 225s - loss: 3.1566 - accuracy: 0.4724 - top_5: 0.6742 - top_10: 0.7423
Epoch 42/78
5177/5177 - 224s - loss: 3.1325 - accuracy: 0.4761 - top_5: 0.6775 - top_10: 0.7449
Epoch 43/78
5177/5177 - 217s - loss: 3.1113 - accuracy: 0.4800 - top_5: 0.6804 - top_10: 0.7469
Epoch 44/78
5177/5177 - 218s - loss: 3.0864 - accuracy: 0.4848 - top_5: 0.6835 - top_10: 0.7492
Epoch 45/78
5177/5177 - 216s - loss: 3.0622 - accuracy: 0.4885 - top_5: 0.6867 - top_10: 0.7519
Epoch 46/78
5177/5177 - 219s - loss: 3.0434 - accuracy: 0.4918 - top_5: 0.6893 - top_10: 0.7538
Epoch 47/78
5177/5177 - 215s - loss: 3.0187 - accuracy: 0.4952 - top_5: 0.6922 - top_10: 0.7563
Epoch 48/78
5177/5177 - 219s - loss: 2.9970 - accuracy: 0.4996 - top_5: 0.6953 - top_10: 0.7583
Epoch 49/78
5177/5177 - 215s - loss: 2.9854 - accuracy: 0.5017 - top_5: 0.6963 - top_10: 0.7590
Epoch 50/78
5177/5177 - 215s - loss: 2.9622 - accuracy: 0.5054 - top_5: 0.6992 - top_10: 0.7613
Epoch 51/78
5177/5177 - 218s - loss: 2.9441 - accuracy: 0.5080 - top_5: 0.7016 - top_10: 0.7632
Epoch 52/78
5177/5177 - 218s - loss: 2.9261 - accuracy: 0.5116 - top_5: 0.7036 - top_10: 0.7648
Epoch 53/78
5177/5177 - 214s - loss: 2.9078 - accuracy: 0.5141 - top_5: 0.7061 - top_10: 0.7663
Epoch 54/78
5177/5177 - 215s - loss: 2.8889 - accuracy: 0.5176 - top_5: 0.7080 - top_10: 0.7683
Epoch 55/78
5177/5177 - 221s - loss: 2.8730 - accuracy: 0.5202 - top_5: 0.7099 - top_10: 0.7694
Epoch 56/78
5177/5177 - 233s - loss: 2.8600 - accuracy: 0.5225 - top_5: 0.7110 - top_10: 0.7703
Epoch 57/78
5177/5177 - 232s - loss: 2.8435 - accuracy: 0.5254 - top_5: 0.7135 - top_10: 0.7721
Epoch 58/78
5177/5177 - 234s - loss: 2.8270 - accuracy: 0.5278 - top_5: 0.7151 - top_10: 0.7734
Epoch 59/78
5177/5177 - 235s - loss: 2.8128 - accuracy: 0.5306 - top_5: 0.7166 - top_10: 0.7742
Epoch 60/78
5177/5177 - 241s - loss: 2.8020 - accuracy: 0.5323 - top_5: 0.7179 - top_10: 0.7752
Epoch 61/78
[93m[WARNING] Model folder already exists...[0m
[92m[INFO] Best epoch number: 78[0m
Epoch 1/78
5177/5177 - 181s - loss: 7.7553 - accuracy: 0.0408 - top_5: 0.0817 - top_10: 0.1072
Epoch 2/78
5177/5177 - 179s - loss: 7.6008 - accuracy: 0.0814 - top_5: 0.1664 - top_10: 0.2132
Epoch 3/78
5177/5177 - 176s - loss: 7.3826 - accuracy: 0.0842 - top_5: 0.1788 - top_10: 0.2324
Epoch 4/78
5177/5177 - 177s - loss: 7.0992 - accuracy: 0.0975 - top_5: 0.1876 - top_10: 0.2450
Epoch 5/78
5177/5177 - 175s - loss: 6.7919 - accuracy: 0.1167 - top_5: 0.2047 - top_10: 0.2624
Epoch 6/78
5177/5177 - 174s - loss: 6.5063 - accuracy: 0.1399 - top_5: 0.2328 - top_10: 0.2863
Epoch 7/78
5177/5177 - 175s - loss: 6.2340 - accuracy: 0.1630 - top_5: 0.2636 - top_10: 0.3140
Epoch 8/78
5177/5177 - 177s - loss: 5.9837 - accuracy: 0.1847 - top_5: 0.2933 - top_10: 0.3453
Epoch 9/78
5177/5177 - 175s - loss: 5.7465 - accuracy: 0.2035 - top_5: 0.3235 - top_10: 0.3809
Epoch 10/78
5177/5177 - 174s - loss: 5.5244 - accuracy: 0.2205 - top_5: 0.3539 - top_10: 0.4154
Epoch 11/78
5177/5177 - 178s - loss: 5.3181 - accuracy: 0.2370 - top_5: 0.3815 - top_10: 0.4461
Epoch 12/78
5177/5177 - 174s - loss: 5.1273 - accuracy: 0.2517 - top_5: 0.4051 - top_10: 0.4737
Epoch 13/78
5177/5177 - 176s - loss: 4.9493 - accuracy: 0.2659 - top_5: 0.4276 - top_10: 0.4992
Epoch 14/78
5177/5177 - 178s - loss: 4.7855 - accuracy: 0.2788 - top_5: 0.4480 - top_10: 0.5227
Epoch 15/78
5177/5177 - 175s - loss: 4.6356 - accuracy: 0.2906 - top_5: 0.4670 - top_10: 0.5426
Epoch 16/78
5177/5177 - 174s - loss: 4.4963 - accuracy: 0.3029 - top_5: 0.4829 - top_10: 0.5609
Epoch 17/78
5177/5177 - 177s - loss: 4.3737 - accuracy: 0.3135 - top_5: 0.4979 - top_10: 0.5780
Epoch 18/78
5177/5177 - 181s - loss: 4.2581 - accuracy: 0.3238 - top_5: 0.5121 - top_10: 0.5933
Epoch 19/78
5177/5177 - 177s - loss: 4.1555 - accuracy: 0.3340 - top_5: 0.5247 - top_10: 0.6074
Epoch 20/78
5177/5177 - 172s - loss: 4.0659 - accuracy: 0.3433 - top_5: 0.5358 - top_10: 0.6192
Epoch 21/78
5177/5177 - 172s - loss: 3.9845 - accuracy: 0.3518 - top_5: 0.5473 - top_10: 0.6309
Epoch 22/78
5177/5177 - 177s - loss: 3.9096 - accuracy: 0.3607 - top_5: 0.5581 - top_10: 0.6415
Epoch 23/78
5177/5177 - 180s - loss: 3.8522 - accuracy: 0.3679 - top_5: 0.5668 - top_10: 0.6496
Epoch 24/78
5177/5177 - 186s - loss: 3.7928 - accuracy: 0.3757 - top_5: 0.5757 - top_10: 0.6581
Epoch 25/78
5177/5177 - 185s - loss: 3.7401 - accuracy: 0.3837 - top_5: 0.5842 - top_10: 0.6659
Epoch 26/78
5177/5177 - 192s - loss: 3.6872 - accuracy: 0.3904 - top_5: 0.5924 - top_10: 0.6736
Epoch 27/78
5177/5177 - 189s - loss: 3.6383 - accuracy: 0.3975 - top_5: 0.6003 - top_10: 0.6807
Epoch 28/78
5177/5177 - 197s - loss: 3.5937 - accuracy: 0.4041 - top_5: 0.6074 - top_10: 0.6867
Epoch 29/78
5177/5177 - 195s - loss: 3.5479 - accuracy: 0.4111 - top_5: 0.6147 - top_10: 0.6934
Epoch 30/78
5177/5177 - 199s - loss: 3.5093 - accuracy: 0.4171 - top_5: 0.6206 - top_10: 0.6987
Epoch 31/78
5177/5177 - 203s - loss: 3.4686 - accuracy: 0.4228 - top_5: 0.6274 - top_10: 0.7045
Epoch 32/78
5177/5177 - 205s - loss: 3.4299 - accuracy: 0.4287 - top_5: 0.6333 - top_10: 0.7092
Epoch 33/78
5177/5177 - 205s - loss: 3.3989 - accuracy: 0.4341 - top_5: 0.6381 - top_10: 0.7134
Epoch 34/78
5177/5177 - 204s - loss: 3.3642 - accuracy: 0.4390 - top_5: 0.6434 - top_10: 0.7178
Epoch 35/78
5177/5177 - 206s - loss: 3.3294 - accuracy: 0.4443 - top_5: 0.6491 - top_10: 0.7220
Epoch 36/78
5177/5177 - 205s - loss: 3.2980 - accuracy: 0.4492 - top_5: 0.6536 - top_10: 0.7264
Epoch 37/78
5177/5177 - 199s - loss: 3.2695 - accuracy: 0.4540 - top_5: 0.6582 - top_10: 0.7298
Epoch 38/78
5177/5177 - 206s - loss: 3.2387 - accuracy: 0.4593 - top_5: 0.6624 - top_10: 0.7328
Epoch 39/78
5177/5177 - 201s - loss: 3.2088 - accuracy: 0.4637 - top_5: 0.6665 - top_10: 0.7360
Epoch 40/78
5177/5177 - 190s - loss: 3.1848 - accuracy: 0.4676 - top_5: 0.6699 - top_10: 0.7391
Epoch 41/78
5177/5177 - 197s - loss: 3.1580 - accuracy: 0.4728 - top_5: 0.6741 - top_10: 0.7422
Epoch 42/78
5177/5177 - 198s - loss: 3.1350 - accuracy: 0.4766 - top_5: 0.6772 - top_10: 0.7444
Epoch 43/78
5177/5177 - 198s - loss: 3.1078 - accuracy: 0.4808 - top_5: 0.6811 - top_10: 0.7471
Epoch 44/78
5177/5177 - 209s - loss: 3.0861 - accuracy: 0.4839 - top_5: 0.6835 - top_10: 0.7494
Epoch 45/78
5177/5177 - 191s - loss: 3.0645 - accuracy: 0.4884 - top_5: 0.6866 - top_10: 0.7517
Epoch 46/78
5177/5177 - 190s - loss: 3.0415 - accuracy: 0.4920 - top_5: 0.6897 - top_10: 0.7539
Epoch 47/78
5177/5177 - 189s - loss: 3.0221 - accuracy: 0.4956 - top_5: 0.6920 - top_10: 0.7560
Epoch 48/78
5177/5177 - 192s - loss: 2.9985 - accuracy: 0.4988 - top_5: 0.6950 - top_10: 0.7583
Epoch 49/78
5177/5177 - 192s - loss: 2.9811 - accuracy: 0.5022 - top_5: 0.6968 - top_10: 0.7594
Epoch 50/78
5177/5177 - 192s - loss: 2.9625 - accuracy: 0.5050 - top_5: 0.6993 - top_10: 0.7614
Epoch 51/78
5177/5177 - 194s - loss: 2.9430 - accuracy: 0.5082 - top_5: 0.7018 - top_10: 0.7636
Epoch 52/78
5177/5177 - 196s - loss: 2.9241 - accuracy: 0.5114 - top_5: 0.7037 - top_10: 0.7649
Epoch 53/78
5177/5177 - 191s - loss: 2.9054 - accuracy: 0.5150 - top_5: 0.7059 - top_10: 0.7666
Epoch 54/78
5177/5177 - 195s - loss: 2.8907 - accuracy: 0.5173 - top_5: 0.7080 - top_10: 0.7677
Epoch 55/78
5177/5177 - 198s - loss: 2.8763 - accuracy: 0.5203 - top_5: 0.7096 - top_10: 0.7692
Epoch 56/78
5177/5177 - 208s - loss: 2.8613 - accuracy: 0.5227 - top_5: 0.7115 - top_10: 0.7704
Epoch 57/78
5177/5177 - 212s - loss: 2.8405 - accuracy: 0.5253 - top_5: 0.7139 - top_10: 0.7728
Epoch 58/78
5177/5177 - 216s - loss: 2.8297 - accuracy: 0.5279 - top_5: 0.7150 - top_10: 0.7732
Epoch 59/78
5177/5177 - 216s - loss: 2.8191 - accuracy: 0.5296 - top_5: 0.7159 - top_10: 0.7736
Epoch 60/78
5177/5177 - 215s - loss: 2.7965 - accuracy: 0.5336 - top_5: 0.7189 - top_10: 0.7757
Epoch 61/78
5177/5177 - 215s - loss: 2.7863 - accuracy: 0.5348 - top_5: 0.7199 - top_10: 0.7766
Epoch 62/78
5177/5177 - 218s - loss: 2.7684 - accuracy: 0.5375 - top_5: 0.7220 - top_10: 0.7784
Epoch 63/78
5177/5177 - 215s - loss: 2.7606 - accuracy: 0.5397 - top_5: 0.7227 - top_10: 0.7786
Epoch 64/78
5177/5177 - 220s - loss: 2.7458 - accuracy: 0.5421 - top_5: 0.7242 - top_10: 0.7796
Epoch 65/78
5177/5177 - 216s - loss: 2.7327 - accuracy: 0.5441 - top_5: 0.7253 - top_10: 0.7804
Epoch 66/78
5177/5177 - 217s - loss: 2.7173 - accuracy: 0.5465 - top_5: 0.7272 - top_10: 0.7821
Epoch 67/78
5177/5177 - 220s - loss: 2.7094 - accuracy: 0.5482 - top_5: 0.7279 - top_10: 0.7822
Epoch 68/78
5177/5177 - 217s - loss: 2.6929 - accuracy: 0.5510 - top_5: 0.7299 - top_10: 0.7843
Epoch 69/78
5177/5177 - 220s - loss: 2.6844 - accuracy: 0.5521 - top_5: 0.7307 - top_10: 0.7847
Epoch 70/78
5177/5177 - 218s - loss: 2.6744 - accuracy: 0.5543 - top_5: 0.7316 - top_10: 0.7849
Epoch 71/78
5177/5177 - 222s - loss: 2.6644 - accuracy: 0.5560 - top_5: 0.7328 - top_10: 0.7858
Epoch 72/78
5177/5177 - 218s - loss: 2.6525 - accuracy: 0.5583 - top_5: 0.7346 - top_10: 0.7872
Epoch 73/78
5177/5177 - 220s - loss: 2.6396 - accuracy: 0.5602 - top_5: 0.7353 - top_10: 0.7878
Epoch 74/78
5177/5177 - 219s - loss: 2.6307 - accuracy: 0.5616 - top_5: 0.7361 - top_10: 0.7883
Epoch 75/78
5177/5177 - 222s - loss: 2.6202 - accuracy: 0.5633 - top_5: 0.7376 - top_10: 0.7898
Epoch 76/78
5177/5177 - 223s - loss: 2.6110 - accuracy: 0.5652 - top_5: 0.7386 - top_10: 0.7903
Epoch 77/78
5177/5177 - 222s - loss: 2.6013 - accuracy: 0.5669 - top_5: 0.7393 - top_10: 0.7909
Epoch 78/78
5177/5177 - 223s - loss: 2.5923 - accuracy: 0.5688 - top_5: 0.7402 - top_10: 0.7914
[92m[INFO] Loading best model...[0m
[92m[INFO] {'ACCURACY': 0.018631013, 'TOP5ACC': 0.05930382, 'TOP10ACC': 0.08794284}[0m
[92m[INFO] {'loss': 3.564277172088623, 'accuracy': 0.3882368803024292, 'top_5': 0.5758569836616516, 'top_10': 0.6475713849067688}[0m


[92m[INFO] 'Quiero comer arroz con arroz con arroz comer'[0m
\LEMM: quiero comer arroz con arroz con arroz comer
	BOW: con
	- Basta Pasta
		▲ spaghetti,parmesan,pasta,prosciutto,japanese,tock,uni,fusion,ferrara,dalla,con,influence,boathouse,revolving,kitchen,sea,asian,playwright,cutter,essex
		∩ con
	- Victor's Cafe
		▲ victor,cuban,plantain,mojito,ceviche,flan,churro,shred,oxtail,snapper,jersey,skirt,lava,con,croquette,suckle,bean,sangria,pig,specialty
		∩ con
	- Havana NY
		▲ havana,cuban,mojito,pawn,plantain,management,pollo,bean,con,feedback,rice,chorizo,yellow,pork,grocery,thrilled,latin,ham,bone,empanadas
		∩ con
[93m[WARNING] Model folder already exists...[0m
[92m[INFO] Best epoch number: 78[0m
[92m[INFO] Model already trained. Loading weights...[0m
[92m[INFO] {'ACCURACY': 0.018631013, 'TOP5ACC': 0.05930382, 'TOP10ACC': 0.08794284}[0m
[92m[INFO] {'loss': 3.564277172088623, 'accuracy': 0.3882368803024292, 'top_5': 0.5758569836616516, 'top_10': 0.6475713849067688}[0m


[92m[INFO] 'Quiero comer arroz con arroz con arroz comer'[0m
\LEMM: quiero comer arroz con arroz con arroz comer
	BOW: con
	- Basta Pasta
		▲ spaghetti,parmesan,pasta,prosciutto,japanese,tock,uni,fusion,ferrara,dalla,con,influence,boathouse,revolving,kitchen,sea,asian,playwright,cutter,essex
		∩ con
	- Victor's Cafe
		▲ victor,cuban,plantain,mojito,ceviche,flan,churro,shred,oxtail,snapper,jersey,skirt,lava,con,croquette,suckle,bean,sangria,pig,specialty
		∩ con
	- Havana NY
		▲ havana,cuban,mojito,pawn,plantain,management,pollo,bean,con,feedback,rice,chorizo,yellow,pork,grocery,thrilled,latin,ham,bone,empanadas
		∩ con
